{
  "user": {
    "preferred_name": "Alex",
    "full_name": "",
    "author_name": "Alex",
    "technical_username": "alex",
    "role": "Knowledge worker",
    "timezone": "UTC",
    "locale": "en",
    "language": "English",
    "communication_style": "Direct, concise, practical"
  },
  "system": {
    "name": "Knowledge OS",
    "short_name": "KOS",
    "root_folder_name": "Knowledge OS",
    "description": "A portable operating system for durable knowledge and active work.",
    "motto": "",
    "installation_date": "2026-09-18"
  },
  "privacy": {
    "default_ai_access": "internal",
    "restricted_folders": [
      "03 - Personal",
      "09 - Attachments"
    ],
    "business_ai_access": "internal",
    "personal_ai_access": "restricted",
    "linked_source_ai_access": "restricted",
    "exclude_sensitive_automatically": true
  },
  "rhythm": {
    "daily_review_time": "17:00",
    "weekly_review_day": "Friday",
    "monthly_review": true,
    "daily_note_generation": true,
    "inbox_processing": true,
    "memory_maintenance": true,
    "handoff_maintenance": true,
    "git_review": false,
    "project_health_checks": true
  },
  "installation": {
    "mode": "standard",
    "target_directory": "Knowledge OS",
    "initialize_git": false,
    "create_initial_commit": false,
    "include_samples": false,
    "include_gitkeep": true,
    "enable_windows_scripts": true,
    "enable_unix_scripts": true,
    "configure_external_integrations": false,
    "allow_overwrite": false,
    "custom_modules": [],
    "providers": [
      "codex",
      "claude"
    ]
  },
  "intended_use": [
    "projects",
    "personal-management",
    "research",
    "learning"
  ],
  "tools": [
    "obsidian",
    "vscode"
  ]
}
